{
  "criteria": [
    {
      "criterion_id": "CP-DSB-06:filter_parameters",
      "status": "unknown",
      "evidence": "The Lowpass block parameter dialog is not visible in this view."
    },
    {
      "criterion_id": "CP-DSB-06:gain_parameters",
      "status": "match",
      "evidence": "The Block Parameters: Recovery dialog shows Gain set to 2."
    },
    {
      "criterion_id": "CP-DSB-06:receiver_chain",
      "status": "unknown",
      "evidence": "The underlying canvas wiring is occluded by the open Block Parameters dialog."
    }
  ],
  "action_findings": [
    {
      "action_id": "CP-DSB-06/filter-create",
      "status": "unknown",
      "evidence": "The Lowpass block is occluded by the settings dialog."
    },
    {
      "action_id": "CP-DSB-06/filter-settings",
      "status": "unknown",
      "evidence": "The Lowpass dialog is not open."
    },
    {
      "action_id": "CP-DSB-06/gain-create",
      "status": "match",
      "evidence": "The Block Parameters: Recovery dialog title proves the Recovery gain block exists."
    },
    {
      "action_id": "CP-DSB-06/gain-settings",
      "status": "match",
      "evidence": "The Block Parameters: Recovery dialog shows Gain set to 2."
    },
    {
      "action_id": "CP-DSB-06/chain",
      "status": "unknown",
      "evidence": "The connection path is occluded by the parameter dialog."
    }
  ],
  "uncertainties": [
    "Lowpass block parameters are hidden behind the active Recovery dialog.",
    "Receiver-chain connections are occluded by the foreground window."
  ],
  "screen_guidance": [
    {
      "action_id": "CP-DSB-06/gain-settings",
      "mode": "annotate",
      "targets": [
        {
          "target_id": "recovery_gain.value",
          "status": "resolved",
          "region": {
            "x": 0.155,
            "y": 0.474,
            "width": 0.408,
            "height": 0.063
          }
        }
      ],
      "marks": [
        {
          "kind": "box",
          "cue_id": "b1",
          "target_id": "recovery_gain.value"
        },
        {
          "kind": "text",
          "cue_id": "t1",
          "anchor": {
            "target_id": "recovery_gain.value",
            "u": 0.5,
            "v": 0.5
          },
          "text_ref": "setting_0"
        }
      ]
    },
    {
      "action_id": "CP-DSB-06/chain",
      "mode": "text_only",
      "targets": [
        {
          "target_id": "workspace.canvas",
          "status": "unresolved",
          "region": null
        }
      ],
      "marks": []
    }
  ]
}