{
  "criteria": [
    {
      "criterion_id": "CP-DSB-10:recovery_reading",
      "status": "unknown",
      "evidence": "Synthetic contract fixture; not real visual evidence."
    },
    {
      "criterion_id": "CP-DSB-10:observation_record",
      "status": "unknown",
      "evidence": "Synthetic contract fixture; not real visual evidence."
    }
  ],
  "action_findings": [
    {
      "action_id": "CP-DSB-10/open-scope",
      "status": "unknown",
      "evidence": "Synthetic contract fixture."
    },
    {
      "action_id": "CP-DSB-10/compare",
      "status": "unknown",
      "evidence": "Synthetic contract fixture."
    },
    {
      "action_id": "CP-DSB-10/record",
      "status": "unknown",
      "evidence": "Synthetic contract fixture."
    }
  ],
  "uncertainties": [],
  "screen_guidance": [
    {
      "action_id": "CP-DSB-10/compare",
      "mode": "annotate",
      "targets": [
        {
          "target_id": "recovery_scope.original_trace",
          "status": "resolved",
          "region": {
            "x": 0.2,
            "y": 0.2,
            "width": 0.25,
            "height": 0.1
          }
        },
        {
          "target_id": "recovery_scope.recovered_trace",
          "status": "resolved",
          "region": {
            "x": 0.2,
            "y": 0.5,
            "width": 0.25,
            "height": 0.1
          }
        }
      ],
      "marks": [
        {
          "kind": "box",
          "cue_id": "focus-0",
          "target_id": "recovery_scope.original_trace"
        },
        {
          "kind": "box",
          "cue_id": "focus-1",
          "target_id": "recovery_scope.recovered_trace"
        },
        {
          "kind": "arrow",
          "cue_id": "compare",
          "relationship_id": "recovery.compare",
          "from": {
            "target_id": "recovery_scope.original_trace",
            "u": 1,
            "v": 0.5
          },
          "to": {
            "target_id": "recovery_scope.recovered_trace",
            "u": 1,
            "v": 0.5
          }
        },
        {
          "kind": "text",
          "cue_id": "note",
          "anchor": {
            "target_id": "recovery_scope.original_trace",
            "u": 0,
            "v": 1
          },
          "text_ref": "canonical_instruction"
        }
      ]
    }
  ]
}
